<?xml version="1.0" encoding="UTF-8"?>
<spdb xsi:noNamespaceSchemaLocation="../../xml/species.xsd" xmlns:xsi="http://www.w3.org/2001/XMLSchema-instance">
  <sp chemicalSymbol="N" name="nitrogen" z="-7.00000" mass="25532.72506">
    <muffinTin rmin="0.100000E-04" radius="1.4500" rinf="18.9090" radialmeshPoints="250"/>
    <atomicState n="1" l="0" kappa="1" occ="2.00000" core="true"/>
    <atomicState n="2" l="0" kappa="1" occ="2.00000" core="false"/>
    <atomicState n="2" l="1" kappa="1" occ="1.00000" core="false"/>
    <atomicState n="2" l="1" kappa="2" occ="2.00000" core="false"/>
    <basis>
      <default type="lapw" trialEnergy="0.1500" searchE="false"/>
      <lo l="0">
        <wf matchingOrder="0" trialEnergy="0.1500" searchE="false"/>
        <wf matchingOrder="1" trialEnergy="0.1500" searchE="false"/>
      </lo>
      <lo l="1">
        <wf matchingOrder="0" trialEnergy="0.1500" searchE="false"/>
        <wf matchingOrder="1" trialEnergy="0.1500" searchE="false"/>
      </lo>
    </basis>
  </sp>
</spdb>
