<spdb xsi:noNamespaceSchemaLocation="../../xml/species.xsd" xmlns:xsi="http://www.w3.org/2001/XMLSchema-instance">
  <sp chemicalSymbol="S" name="sulphur" z="-16.0000" mass="58452.74216">
    <muffinTin rmin="0.100000E-04" radius="1.4500" rinf="20.3453" radialmeshPoints="300"/>
    <atomicState n="1" l="0" kappa="1" occ="2.00000" core="true"/>
    <atomicState n="2" l="0" kappa="1" occ="2.00000" core="true"/>
    <atomicState n="2" l="1" kappa="1" occ="2.00000" core="true"/>
    <atomicState n="2" l="1" kappa="2" occ="4.00000" core="true"/>
    <atomicState n="3" l="0" kappa="1" occ="2.00000" core="false"/>
    <atomicState n="3" l="1" kappa="1" occ="2.00000" core="false"/>
    <atomicState n="3" l="1" kappa="2" occ="2.00000" core="false"/>
    <basis>
      <default type="lapw" trialEnergy="0.1500" searchE="false"/>
      
      <custom l="0" type="lapw" trialEnergy="-0.60" searchE="false"/>
      <lo l="0">
        <wf matchingOrder="0" trialEnergy="-0.60" searchE="false"/>
        <wf matchingOrder="2" trialEnergy="-0.60" searchE="false"/>
      </lo>

      <custom l="1" type="lapw" trialEnergy="0.15" searchE="false"/>
      <lo l="1">
        <wf matchingOrder="0" trialEnergy="0.15" searchE="false"/>
        <wf matchingOrder="2" trialEnergy="0.15" searchE="false"/>
      </lo>

    </basis>
  </sp>
</spdb>
