<?xml version="1.0" encoding="UTF-8"?>
<spdb xsi:noNamespaceSchemaLocation="../../xml/species.xsd" xmlns:xsi="http://www.w3.org/2001/XMLSchema-instance">
  <sp chemicalSymbol="Be" name="beryllium" z="-4.00000" mass="16428.20279">
    <muffinTin rmin="0.100000E-04" radius="1.4500" rinf="22.8059" radialmeshPoints="250"/>
    <atomicState n="1" l="0" kappa="1" occ="2.00000" core="true"/>
    <atomicState n="2" l="0" kappa="1" occ="2.00000" core="false"/>
    <basis>
      <default type="lapw" trialEnergy="0.1500" searchE="false"/>
      <custom l="0" type="apw+lo" trialEnergy="0.1500" searchE="true"/>
    </basis>
    <!-- Exciting code version: Lithium -->
    <!-- Generation Scheme: simple -->
  </sp>
</spdb>
