<?xml version="1.0" encoding="UTF-8"?>
<spdb xsi:noNamespaceSchemaLocation="../../xml/species.xsd" xmlns:xsi="http://www.w3.org/2001/XMLSchema-instance">
  <sp chemicalSymbol="Na" name="sodium" z="-11.0000" mass="41907.78700">
    <muffinTin rmin="0.100000E-04" radius="2.0000" rinf="30.3961" radialmeshPoints="300"/>
    <atomicState n="1" l="0" kappa="1" occ="2.00000" core="true"/>
    <atomicState n="2" l="0" kappa="1" occ="2.00000" core="false"/>
    <atomicState n="2" l="1" kappa="1" occ="2.00000" core="false"/>
    <atomicState n="2" l="1" kappa="2" occ="4.00000" core="false"/>
    <atomicState n="3" l="0" kappa="1" occ="1.00000" core="false"/>
    <basis>
      <default type="lapw" trialEnergy="0.1500" searchE="false"/>
      <custom l="0" type="apw+lo" trialEnergy="0.1500" searchE="true"/>
      <custom l="1" type="apw+lo" trialEnergy="0.1500" searchE="true"/>
      <lo l="0">
        <wf matchingOrder="0" trialEnergy="0.1500" searchE="true"/>
        <wf matchingOrder="1" trialEnergy="0.1500" searchE="true"/>
        <wf matchingOrder="0" trialEnergy="-2.0701" searchE="true"/>
      </lo>
      <lo l="1">
        <wf matchingOrder="0" trialEnergy="0.1500" searchE="true"/>
        <wf matchingOrder="1" trialEnergy="0.1500" searchE="true"/>
        <wf matchingOrder="0" trialEnergy="-1.0637" searchE="true"/>
      </lo>
    </basis>
    <!-- Exciting code version: Lithium -->
    <!-- Generation Scheme: simple -->
  </sp>
</spdb>
